{
  "command": "verify",
  "data": {
    "areas_not_checked": [
      "the systemd journal (not searched by verify)",
      "shell histories and temp directories (/tmp, /var/tmp); re-run with --deep",
      "live processes, mounts and open block devices (offline image scan)",
      "renamed or unknown artifacts not in the registry",
      "a byte-for-byte comparison of the decoy disk against a baseline",
      "Persistent systemd journal, Journal window around each soft-reboot, Swap and hibernation, NixOS account bookkeeping, The hidden session's /run carried into the decoy, An interrupted entry's runtime files in /run, Hidden kernel records imported by the decoy journal, Memory remanence (live host only)",
      "Classic syslog daemon, Shell history, Desktop recent-files lists (re-run with --deep)",
      "Decoy journal reset by the way back: RAM only, gone at power-off",
      "Decoy filesystems the hidden systemd would mount: verify cannot tell what a session wrote to another filesystem",
      "Disks mounted during the hidden session: verify cannot tell what a session wrote to another disk",
      "Network state the hidden session created or changed: a link the decoy adopted looks like one the decoy made itself",
      "Soft-reboot counter and boot ID: RAM only, gone at power-off",
      "Login and boot records around a switch: the records are the decoy's own; verify reports the pieces the way back leaves in /run when their step never ran",
      "The decoy's mounts made again by the way back: RAM only, gone at power-off",
      "EFI NVRAM, RTC and firmware pstore: EFI variables and firmware storage are not part of a disk image",
      "SMART power-on hours: a disk image does not carry SMART counters",
      "SSD flash-translation-layer remnants: no host-side read reaches remapped flash cells, so `nails rehearse` cannot see them either",
      "NetworkManager connection records: a connection record the decoy wrote after adopting a session's link looks like one the decoy made itself",
      "Copy-on-write and compressed storage history: a raw scan reads old copy-on-write extents but cannot read compressed ones, so `nails rehearse` reports a compressed or copy-on-write decoy as not checked rather than clean: a mounted one (a zfs dataset included) by its mount, an image or an unmounted device by its superblock, and a whole disk partition by partition, where an encrypted partition, or one on which no filesystem is identified, is not checked either",
      "setup traces an examiner looks for (LVM metadata archive and backup, udisks2 state, crypttab and fstab entries, LUKS headers on partitions, High-entropy unpartitioned space, Encrypted container candidates, Encryption tooling and its access times, History naming a container or unlock): run verify --offline --root <image> --examiner"
    ],
    "checks_run": 2,
    "config_aware": true,
    "config_paths_checked": 0,
    "findings": [
      {
        "category": "file",
        "fix_guidance": "Left by a session of an earlier release, in RAM; power off (then confirm /run/nails is gone)",
        "message": "Artifact file found: /run/nails",
        "severity": "warn"
      },
      {
        "category": "file",
        "fix_guidance": "Trace on the decoy filesystem; remove it: rm -rf /mnt/nails-pivot",
        "message": "Artifact file found: /mnt/nails-pivot",
        "severity": "critical"
      }
    ],
    "scan_depth": "standard",
    "state_file_status": {
      "kind": "missing",
      "path": "/mnt/data/state.json"
    },
    "status": "critical"
  },
  "ok": false,
  "schema_version": 2
}
